구분,상담 주제,발화 주체,발화 내용,,,,,,,,,,,
070,입시,선생님,상담 신청했지? 어떤 도움이 필요한지 물어봐도 될까?,,,,,,,,,,,
,,학생,"네, 수능 준비가 어려워서 상담을 받고 싶어요. 수능 준비를 어떻게 시작해야 될지 모르겠어요.",,,,,,,,,,,
,,선생님,지금 몇 학년이지?,,,,,,,,,,,
,,학생,"2학년이요. 아직 멀었다고 생각했는데, 다들 벌써 수능 준비한다고 해서...",,,,,,,,,,,
,,선생님,"그렇구나, 진행했던 모의고사는 다 봤니?",,,,,,,,,,,
,,학생,작년 6월이랑 9월에 봤어요. 근데 점수가 생각보다 잘 안 나왔어요.,,,,,,,,,,,
,,선생님,어떤 영역이 특히 어렵게 느껴졌어?,,,,,,,,,,,
,,학생,수학이요. 시간이 부족해서 다 못 풀었어요.,,,,,,,,,,,
,,선생님,수학에서 특히 시간 관리가 어려웠던 거구나. 다른 영역은 어땠어?,,,,,,,,,,,
,,학생,"국어는 그럭저럭이었는데, 영어는 모르는 단어가 많았어요.",,,,,,,,,,,
,,선생님,"그래 알겠어. 그럼 모의고사 성적을 바탕으로, 영역별로 어떤 준비가 필요한지 구체적으로 계획을 함께 세워보면 좋을 거 같아.",,,,,,,,,,,
071,입시,선생님,어떤 상담이 필요해서 왔니?,,,,,,,,,,,
,,학생,제가 어떤 전형으로 접수해야 대학을 갈 수 있을지 모르겠어요.,,,,,,,,,,,
,,선생님,지금까지 생각해본 전형이 있어?,,,,,,,,,,,
,,선생님,학생부 종합 전형이요. 근데 제가 특별한 활동이 없어서 안 될 거 같기도 하고... 고민이 많아요.,,,,,,,,,,,
,,학생,"고민이 많구나, 혹시 내신 성적은 어느정도인지 알 수 있을까?",,,,,,,,,,,
,,선생님,평균 2등급 초반대예요.,,,,,,,,,,,
,,학생,"그럼, 혹시 지금 생각하고 있는 대학이나 학과가 있어?",,,,,,,,,,,
,,선생님,경영학과를 가고 싶어요. 인서울 가고 싶은데 너무 욕심인가요?,,,,,,,,,,,
,,학생,"구체적인 목표가 있어서 다행이다. 다음 상담 때 네 현재 내신, 모의고사 성적, 학생부 기록을 종합적으로 보면서, 목표 대학의 다양한 전형들을 비교해볼까?",,,,,,,,,,,
,,선생님,네 선생님 그러면 좋을 거 같아요. 감사합니다.,,,,,,,,,,,
072,입시,학생,쌤 큰일 났어요. 저 대학교 못 가면 어떡해요,,,,,,,,,,,
,,선생님,대학교는 갈 수 있지. 가고 싶은 대학교를 못 갈까 봐 걱정을 해야지. 가고 싶은 대학이나 과는 있니?,,,,,,,,,,,
,,학생,대학교는 아직 못 정했고요. 과는 있어요. 승무원이 꿈이라서 항공과 목표하고 있어요.,,,,,,,,,,,
,,선생님,OO이도 수시를 생각 중이니? 보통 항공과 준비했던 학생들이 정시보단 수시로들 많이 도전하더라구.,,,,,,,,,,,
,,학생,아 그런가요? 저는 수능만 생각하고 모고 망해서 승무원 못 될까 봐 걱정했어요. 저는 그냥 승무원 될 수 있는 과만 가면 돼요. 지역도 어디든 상관없어요.,,,,,,,,,,,
,,선생님,"그럼 OO이 내신 성적이랑 모고 성적을 보자. 그리고 안전/상향 지원 가능한 학교들 좀 찾아보고, 더 수월하게 준비할 수 있는 입시 전형을 선택하면 좋을 것 같네.",,,,,,,,,,,
,,학생,저 내신도 자신 없어서 수능만 생각했는데 괜찮을까요?,,,,,,,,,,,
,,선생님,"수시가 뽑는 인원도 많고, 수능 최저도 없어서 좀 더 수월한 편이거든. 아직까지는 수시를 추천하고 싶은데 선생님도 OO이 성적을 봐야 좀 더 정확한 답변이 가능할 것 같아",,,,,,,,,,,
073,입시,학생,선생님 저 3월/6월 모의고사 성적표 가지고 왔어요,,,,,,,,,,,
,,선생님,OO이는 정시랑 논술 준비한다고 했지? 어디보자.. 성적이 많이 좋아졌네. 근데 서울대 인문대학은 수능 외에도 학교 성적을 보니까 절대 내신도 놓으면 안 되는 거 알지?,,,,,,,,,,,
,,학생,네네. 내신도 가능하면 최대한 신경써서 유지할 거예여.,,,,,,,,,,,
,,선생님,일단 고사 성적표 보니 다른 과목에 비해 국어가 어렵니?,,,,,,,,,,,
,,학생,그건 아니고요. 아침잠이 많아서 집중이 잘 안 되는 게 문제에요,,,,,,,,,,,
,,선생님,그럼 앞으로 수능 대비해서 수능 시간표에 맞춰 컨디션을 맞추는 노력이 필요할 것 같네,,,,,,,,,,,
,,학생,고칠 수 있을까요?,,,,,,,,,,,
,,선생님,"성적도 점점 좋아지도록 노력했는 데, 당연히 컨디션 조절도 노력하면 바뀌지 않을까? 컨디션 조절도 결국 능력 싸움이니까 OO이는 할 수 있을거야",,,,,,,,,,,
074,입시,선생님,OO이는 장래희망이 정해졌다고 했지?,,,,,,,,,,,
,,학생,넵. 저는 유치원선생님이 되고 싶어요. 그래서 과를 찾아봤는데 생각보다 다양해서 어떤 걸 집중적으로 선택할지 모르겠어요.,,,,,,,,,,,
,,선생님,알아본 과들이 무엇일까?,,,,,,,,,,,
,,학생,"유아교육과, 유아교육학과, 아동복지과, 아동학과, 아동복지학과요. 커리어넷에 검색하니까 이렇게 나오더라구요. 내용도 거의 비슷해서 잘 모르겠어요",,,,,,,,,,,
,,선생님,그렇네 과명만 들어봐도 거의 비슷해서 선택에 어려움이 있을 것 같네. 선생님이 알고 있는 걸 좀 쉽게 설명해 주자면 유아교육과는 사범대 소속이라 좀 더 유아 교육에 전문적인 내용을 배우는 것으로 알고 있어.,,,,,,,,,,,
,,학생,저는 가능하면 좀 더 전문적인 유치원 선생님이 되고 싶어요.,,,,,,,,,,,
,,선생님,그러면 찾아본 과들의 차이점과 향후 연관 직업들을 찾아보고 OO이가 생각하는 전문적인 선생님과 맞는 부분을 알아보자. 우선 선생님이 관련된 사이트를 알려줄테니까 한번 찾아서 보고 다시 상담을 해볼까?,,,,,,,,,,,
075,입시,학생,"선생님, 안녕하세요.",,,,,,,,,,,
,,선생님,"안녕, 오늘 '입시' 관련해서 상담을 받고 싶다고 써 놨더라. 구체적으로 무엇이 궁금하니?",,,,,,,,,,,
,,학생,"네, 맞아요. 현재 정시를 준비하고 있는데... 제가 수시로 딱히 승부를 걸 만한 게 없어서요.",,,,,,,,,,,
,,선생님,그래? 이제껏 학교 생활을 하면서 차곡차곡 모아온 OO이만의 특색이 담긴 기록이 있을 텐데. 반드시 정시여야 하는 이유가 있니?,,,,,,,,,,,
,,학생,내신이 별로거든요. 사실 제가 1학년 때 성적이 많이 안 좋아요. 그리고 모의고사 등급이 내신 등급보다 잘 나오기도 하고...,,,,,,,,,,,
,,선생님,"어디 보자... 음, 구체적인 분석은 좀 더 필요하겠지만, 선생님이 보기에 이 정도 등급 차는 많이들 나긴 해. 수시를 완전히 포기하기에는 좀 아까운 거지.",,,,,,,,,,,
,,학생,지금 이것도 겨우 받은 내신 성적이라서요. 차라리 이 시간에 수능 공부를 하는 게 낫지 않을까 싶어요.,,,,,,,,,,,
,,선생님,한쪽에 치우친 전략은 그만큼 위험 부담이 있기 때문에... 선생님으로서는 안전한 전략을 추천한다만. 오늘은 OO이의 의견을 좀 더 들어보고 앞으로의 계획을 좀 더 상세히 살펴봐야겠구나.,,,,,,,,,,,
076,입시,학생,"선생님, 안녕하세요!",,,,,,,,,,,
,,선생님,오랜만이야. 그동안 잘 지냈니?,,,,,,,,,,,
,,학생,"네, 선생님.",,,,,,,,,,,
,,선생님,지난 번 상담 때 고민했던 대학교 학과나 전공에 대해서 생각해 보았니?,,,,,,,,,,,
,,학생,네. 오늘도 그 상담하러 온 거예요. 저번에는 막연하게 게임을 좋아하니까 프로그래밍 관련 학과를 생각했었는데...,,,,,,,,,,,
,,선생님,"그래, 그랬지.",,,,,,,,,,,
,,학생,저 기후 관련 학과로 진로를 정했어요.,,,,,,,,,,,
,,선생님,그래? 갑자기 환경공학과나 지구과학과를 생각하게 된 이유는 뭐지?,,,,,,,,,,,
,,학생,"사실 게임은 그냥 취미이고 가까이 있다 보니 막연히 그렇게 생각했던 거고요. 그보다는 기후변화나 해양 환경 같은 거에 관심이 많거든요. 지난번에 자연 다큐멘터리를 보면서 엄청 감동받았고, 그동안 독후감 써 놓은 거 보니까 환경 분야 책도 꽤 많았더라고요.",,,,,,,,,,,
,,선생님,비로소 관심사를 찾은 거구나!,,,,,,,,,,,
,,학생,"네, 그래서 제가 찾아보니, 학과 이름이 서로 비슷비슷해서 또 모르겠는 거예요. 환경공학과, 지구해양과학과, 천문학과, 환경생태공학과, 환경에너지공학과, 환경학과, 해양바이오공학과... 서로 조금씩 다른 걸 배울 것 같아서 또 선택을 해야 되더라고요.",,,,,,,,,,,
,,선생님,"비슷해 보이는 학과명이어도, 학교나 학과마다 커리큘럼이나 배우는 것이 조금씩 다르기도 해. 이럴 땐 각 대학교 홈페이지를 참고해 보는 것도 좋아. 오늘은 OO이의 희망 진학 학과 범위를 좀 더 좁혀보자.",,,,,,,,,,,
077,입시,학생,쌤 저 성적에 맞는 대학 좀 추천해주세요. 드라마 작가가 꿈인데 알맞은 학과나 성적이나 걸리는 점이 많아요,,,,,,,,,,,
,,선생님,하고 싶은 일에 맞게 학과를 찾고 있는거구나! 드라마 작가는 글을 써야하니까 글쓰는 학과는 문예창작학과가 대표적이지. 하지만 반드시 가야하는 것은 아니니까 조금 폭넓게 생각해보는 게 좋겠다. 혹시 성적은 지금 어떻게 될까?,,,,,,,,,,,
,,학생,일단 2학년 기준 내신 6등급이에요.,,,,,,,,,,,
,,선생님,그렇구나. 앞으로 성적을 올리는 것도 생각해보자. 우선 말해준 내신 기준으로 선생님이 대학이랑 학과 어디가 좋을지 같이 고민해볼게. 혹시 생각해본 대학은 있어?,,,,,,,,,,,
,,학생,아니요 정해진게 없어요. 근데 웬만하면 여기 충청도 지역이면 좋고 경기도까지 괜찮을 것 같아요.,,,,,,,,,,,
,,선생님,"대학교 위치를 먼저 생각해봤구나. 선생님이 06이가 말해준 지역으로 어떤 대학이 있는지, 괜찮은 학과는 뭐가 있을지 준비해서 상담하면서 더 자세히 알아보도록 하자. 더 궁금한 것 있니?",,,,,,,,,,,
,,학생,아니요 일단 지금 궁금한 건 없어요.,,,,,,,,,,,
,,선생님,알겠어 그럼 상담 시간에 보자.,,,,,,,,,,,
078,입시,학생,쌤 저 간호학과 가려고 하는데 어떤 전형으로 가야할 지 모르겠어요.,,,,,,,,,,,
,,선생님,그래 06이가 어떤 전형으로 가야 유리할지 고민되나보다. 지금 성적은 어떻게 되니?,,,,,,,,,,,
,,학생,일단 내신은 2등급 초반이긴 해요. 그래서 좀 애매해서요,,,,,,,,,,,
,,선생님,그렇구나. 혹시 지금 목표로 하는 대학교는 있니?,,,,,,,,,,,
,,학생,딱 어디라고 정해둔 건 아닌데 인서울로 가고 싶어요.,,,,,,,,,,,
,,선생님,그럼 선생님이 06이 성적이랑 작년 합격자 자료 확인해서 안정적일지 불안할지 전체적으로 검토해보자. 성적 말고도 평가요소 더 있으니까 다 검토해서 어느 전형이 더 유리할지 찾아보는 걸로 하자.,,,,,,,,,,,
,,학생,네 감사합니다. 그때 뵐게요,,,,,,,,,,,
079,입시,선생님,06이 무슨 일있어? ,,,,,,,,,,,
,,학생,썜 저는 무조건 수능으로 가려고 해서요. 내신은 5등급인데 모의고사는 평균 1.7나오는데 연세대 경제학과나 법학과 갈 수 있을까요? ,,,,,,,,,,,
,,선생님,06이는 입시 방향을 되게 빨리 정했네. 무조건 정시로 가려고 모의고사 성적 관리를 열심히 했구나,,,,,,,,,,,
,,학생,네 근데 정시로 가도 내신을 반영 하는지 궁금해서요. 그러면 좀 불리할 수도 있으니까 논술도 생각해보긴 했는데. 준비는 언제부터 해야하는지도 알고 싶어서요.,,,,,,,,,,,
,,선생님,정시 지원할 때 내신 반영하는지랑 논술전형이 궁금했구나. 그럼 입시 전형을 확인해봐야할 것 같아. 그럼 궁금증이랑 입시 전략도 같이 세워볼 수 있을 것 같네. 이따 시간될 때 선생님 찾아올래?,,,,,,,,,,,
,,학생,네 알겠습니다.,,,,,,,,,,,
,,선생님,그래 이따보자~,,,,,,,,,,,
080,입시,학생,쌤 큰일났어요. 학종으로 경북대 화학공학과 쓰려고 하는데 화학이 b나올거같아요. 영향 크겠죠?ㅜㅜㅜ,,,,,,,,,,,
,,선생님,성적이 생각보다 낮아질까봐 걱정이 많겠다. 우선 학생부 종합전형은 성적이 비중높게 반영되긴 하지. 영향이 없다고 할 수는 없어. 하지만 전부는 아니니까 다른 요소들로 보완할 수 있도록 하는 것도 하나의 방법이야.,,,,,,,,,,,
,,학생,"교내 동아리도 관련있는 걸로 했는데, 그래도 성적이 낮으니까 지원할 때 불리할까봐 걱정돼서요.",,,,,,,,,,,
,,선생님,"선생님이 경북대 화학공학과 학생부 종합전형으로 합격한 사례들을 한번 찾아서 비교해서 보여주는게 더 정확할 것 같아. 그러면 지금 성적이 많이 불리한건지 아닌지, 또 보완할 수 있는 부분이 있을지 찾을 수 있을 것 같은데 어떄?",,,,,,,,,,,
,,학생,네 저 진짜 경북대 화학공학과 가고 싶어요...,,,,,,,,,,,
,,선생님,알겠어 선생님이 자료 확인해서 상담 시간에 꼼꼼히 확인해보자.,,,,,,,,,,,
,,학생,감사합니다.,,,,,,,,,,,
081,고교학점제,선생님,어서 오렴. 그동안 잘 지냈지? 오늘은 뭘 도와줄까?,,,,,,,,,,,
,,학생,"선생님 , 고교학점제가 시행된다고 하는데, 도데체 고교학점제가 무엇인지, 또 과목명도 무지 많아서 헷갈리구요, 게다가 성취도니, 석차 등급이니 하는 것도 잘 모르겠어요",,,,,,,,,,,
,,선생님,은서가 고등학생이 되면서 이제 슬슬 대학 진학에 관심을 갖고 있구나,,,,,,,,,,,
,,학생,당연하지요. 저도 대학에 가고 싶으니까요,,,,,,,,,,,
,,선생님,"그럼 선생님과 함께 고교학점제가 무엇인지, 어떤 과목들을 선택할 수 있는지, 선택할 때 어떤 점을 고려해야 하는지, 또 성취 평가제 라는 말이 있는데, 여기에서 다루는 용어에 대해 함께 알아보자",,,,,,,,,,,
082,고교학점제,선생님,어서 오렴. 그동안 잘 지냈지? 오늘은 뭘 도와줄까?,,,,,,,,,,,
,,학생,"선생님. 내년에 배울 과목을 선택하라고 하는데, 어떤 과목을 선택해야 할지 모르겠어요.",,,,,,,,,,,
,,선생님,우리 은서가 이제 하나씩 하나씩 과목을 선택할 시기가 와서 고민이구나.,,,,,,,,,,,
,,학생,왜 이렇게 선택하라고 하는지 모르겠어요. 그냥 정해주면 안되는 건가요?,,,,,,,,,,,
,,선생님,"응. 과목 선택은 학생마다 진로가 다르기 때문에, 그 진로에 맞춰 과목을 선택하는게 학생에게 좋기 때문이야~ 은서는 어떤 분야, 학과를 생각하고 있니?",,,,,,,,,,,
,,학생,저는 이과쪽 이기는 한데요. 공대를 사실 마음에 두고 있어요,,,,,,,,,,,
,,선생님,"공대.  좋지. 은서에게 어울릴 듯한데. 공대를 가려면 일단 공대에서 권장하는 과목,  기본적으로 수학 공부를 많이 해야 하고, 과학에서 물리와 화학은 거의 필수 이지",,,,,,,,,,,
,,학생,"그럼, 수학, 과학 과목 위주로 선택하면 되겠네요",,,,,,,,,,,
,,선생님,그럼 선생님과 함께 하나씩 하나씩 알아볼까?,,,,,,,,,,,
083,고교학점제,선생님,고교학점제를 통해 원하는 과목을 자유롭게 선택할 수 있게 되었어요. 선택 과목은 어떻게 계획하고 있나요?,,,,,,,,,,,
,,학생,사실 아직 뭘 선택해야 할지 고민 중이에요. 어떤 과목이 제 진로에 도움이 될지 잘 모르겠어요.,,,,,,,,,,,
,,선생님,진로를 먼저 정리한 다음 그와 관련된 과목을 선택하는 것이 중요해요. 진로가 어느 방향인가요?,,,,,,,,,,,
,,학생,심리학에 관심이 있어서 그 쪽으로 생각하고 있어요.,,,,,,,,,,,
,,선생님,"심리학과 관련된 과목으로는 사회학이나 윤리학, 그리고 생명과학도 도움이 될 수 있어요. 심리학은 인간 행동과 뇌의 작동을 이해하는 학문이기 때문에 다양한 과목이 관련이 있어요.",,,,,,,,,,,
,,학생,생명과학은 어려워서 자신이 없어요. 꼭 들어야 할까요?,,,,,,,,,,,
,,선생님,심리학의 일부 분야에서는 뇌 과학에 대한 이해가 필요하기도 해요. 꼭 전공하지 않더라도 기본 지식을 쌓아두면 도움이 될 거예요.,,,,,,,,,,,
,,학생,그럼 생명과학도 선택해야겠네요.,,,,,,,,,,,
,,선생님,"네, 그리고 흥미 있는 과목도 한두 가지 선택해서 균형을 맞추는 게 좋아요. 과목 선택은 너무 한쪽으로 치우치지 않도록 하는 게 중요해요.",,,,,,,,,,,
084,고교학점제,선생님,"고교학점제에 따라 성취도 평가가 중요한데, 어떻게 준비하고 있나요?",,,,,,,,,,,
,,학생,성취도 평가 방식이 아직도 헷갈려요. 어떻게 성적에 반영되는 건가요?,,,,,,,,,,,
,,선생님,성취도 평가는 학생의 학습 이해도와 수행평가를 종합적으로 평가하는 방식이에요. 특히 수업에서의 참여도와 과제 완성도가 중요한 역할을 해요.,,,,,,,,,,,
,,학생,그럼 수업 시간에 더 적극적으로 참여해야겠네요.,,,,,,,,,,,
,,선생님,"맞아요. 수업 시간에 질문을 많이 하고, 발표도 자주 하는 게 성취도 평가에 좋은 영향을 미쳐요.",,,,,,,,,,,
,,학생,"발표가 좀 어려운데, 꼭 해야 하나요?",,,,,,,,,,,
,,선생님,"발표는 자신감을 키울 수 있는 좋은 기회예요. 처음에는 어렵겠지만, 자주 하다 보면 점점 나아질 거예요.",,,,,,,,,,,
,,학생,알겠습니다. 그럼 수업 참여를 더 신경 써야겠네요.,,,,,,,,,,,
,,선생님,"네, 그리고 과제는 마감 기한을 잘 지켜서 제출하는 것도 중요해요. 성취도 평가에서는 과제의 질도 중요한 평가 요소예요.",,,,,,,,,,,
,,학생,"네, 과제도 꼼꼼히 준비할게요.",,,,,,,,,,,
,,선생님,그렇게 하면 성취도 평가에서 좋은 결과를 얻을 수 있을 거예요.,,,,,,,,,,,
085,고교학점제,선생님,"안녕하세요, 현이 학생. 상담 신청했다는 소식을 듣고 기다리고 있었어요. 오늘 어떤 이야기를 나누고 싶나요?",,,,,,,,,,,
,,학생,"안녕하세요, 선생님. 제가 고교학점제에 대해 궁금한 게 많아서요. 앞으로 어떻게 과목을 선택해야 할지 고민이 돼요.",,,,,,,,,,,
,,선생님,그렇군요. 우선 현이 학생의 희망 진로나 관심 있는 계열이 있나요?,,,,,,,,,,,
,,학생,저는 국제정치경제학 쪽으로 관심이 많아서 국제정치학이나 국제관계학을 전공하고 싶어요.,,,,,,,,,,,
,,선생님,멋진 목표를 가지고 있네요! 그 분야에 관심을 갖게 된 특별한 계기가 있나요?,,,,,,,,,,,
,,학생,"네, 국제 뉴스를 보면서 세계 정세에 관심이 생겼고, 국제기구에서 일하고 싶다는 생각을 했어요.",,,,,,,,,,,
,,선생님,훌륭해요. 그럼 해당 분야에 도움이 되는 과목들을 선택하는 게 중요하겠네요. 혹시 필요한 과목들이 무엇인지 알고 있나요?,,,,,,,,,,,
,,학생,"정확히는 모르겠지만, 사회나 역사, 그리고 외국어 과목들을 선택해야 할 것 같아요.",,,,,,,,,,,
,,선생님,"맞아요. 특히 정치와 법, 세계사, 경제 과목이 도움이 될 거예요. 그리고 제2외국어도 고려해보는 게 좋아요. 예를 들어 중국어나 스페인어 같은 언어가 국제 기구에서 유용하게 쓰일 수 있어요.",,,,,,,,,,,
,,학생,"아, 제2외국어가 중요한 이유가 있었군요. 선생님 근데가장궁금한게 좋은학교 가는거니까요~그런데 진로 선택 과목의 성취도가 대학 입시에 어떻게 반영되나요?",,,,,,,,,,,
,,선생님,"좋은 질문이에요. 진로 선택 과목은 성취도별로 A, B, C 등급으로 평가되는데, 이는 생활기록부에 기재되고 대학 입시에서도 반영됩니다. 성취도가 높을수록 유리하죠.",,,,,,,,,,,
,,학생,그럼 성취도를 높이기 위해서는 어떻게 해야 할까요?,,,,,,,,,,,
,,선생님,"평가 방식이 서술형이나 논술형으로 다양해졌기 때문에, 깊이 있는 학습이 필요해요. 또한, 학교생활기록부에 기재될 활동들도 적극적으로 참여하면 좋아요.",,,,,,,,,,,
,,학생,이해됐어요. 고등학교 편제표는 어떻게 활용하면 될까요?,,,,,,,,,,,
,,선생님,편제표는 학교에서 개설된 과목들을 확인할 수 있는 자료인데요. 여기서 본인의 진로와 관련된 과목들을 선택하는 게 중요해요.,,,,,,,,,,,
086,고교학점제,학생,"선생님, 안녕하세요~! 선생님, 저 학습 고민이 있어서 찾아왔어요.",,,,,,,,,,,
,,선생님,"안녕, 현이야. 어떤고민이니?",,,,,,,,,,,
,,학생,저는 변화하는 고교학점제 시기에 학교에 편제된 과목에서 점수를 잘받기 위해 구체적으로 진로 연결 학업 계획서를 세워보고싶어요.,,,,,,,,,,,
,,선생님,진로 학업 계획서를 작성해보는 것도 도움이 될 거예요. 자신의 목표와 선택 과목을 어떻게 연계시킬지 구체적으로 생각해볼 수 있죠.,,,,,,,,,,,
,,학생,아 정말요? 그러면 진로 학업 계획서는 어떻게 작성해야 하나요?,,,,,,,,,,,
,,선생님,"자신의 진로 목표를 먼저 명확히 한 다음, 그에 맞는 선택 과목과 학습 전략을 구체적으로 작성하면 돼요. 예를 들어, 국제정치학을 목표로 한다면 관련 과목에서 어떤 역량을 키울지, 또 어떤 활동에 참여할지 계획하는 거예요.",,,,,,,,,,,
,,학생,"선생님, 방금 말씀하신 학업 계획서를 작성할 때, 단순히 과목 이름만 나열하는 것보다 구체적인 학습 목표나 활동 계획을 적는 게 더 좋겠죠?",,,,,,,,,,,
,,선생님,"네, 맞아요. 단순히 과목 이름만 적는 것보다는, 각 과목에서 어떤 역량을 키우고 싶은지, 예를 들어 정치 과목에서는 논리적 사고나 비판적 분석 능력을 키운다든지, 역사 과목에서는 다양한 관점을 이해하는 능력을 강화하겠다든지, 구체적으로 적어주는 것이 더 좋아요. 그리고 활동 계획도 함께 작성하면 대학 입학사정관들이 학생의 학습 의지를 더 잘 이해할 수 있죠.",,,,,,,,,,,
,,학생,"활동 계획이라면, 어떤 활동들이 도움이 될까요? 학교에서 할 수 있는 활동이 생각보다 제한적인 것 같아서요.",,,,,,,,,,,
,,선생님,"학교 내에서도 다양한 활동들이 있지만, 외부 활동도 괜찮아요. 물론 학교생활기록부에는 이제 작성이 안되서 많이 안하는 경향이 있지만, 다양한 경험을 위해 이런것들을 접하는게 중요하다고 봐요. 예를 들어, 모의 유엔 회의나 국제 관계와 관련된 토론 대회, 봉사 활동 등도 도움이 될 수 있어요. 또, 독서 활동도 중요해요. 국제 정치나 경제와 관련된 책들을 읽고 느낀 점을 정리해두면 자기소개서 작성에도 도움이 되지요.",,,,,,,,,,,
,,학생,"아, 독서 활동도 중요하군요. 그럼 진로와 관련된 책들은 어떻게 찾으면 좋을까요? 선생님이 추천해 주실 만한 책이 있을까요?",,,,,,,,,,,
,,선생님,"네, 진로와 관련된 책들은 도서관에서 찾아보거나, 관련 분야의 전문가들이 추천하는 책 리스트를 참고해보면 좋아요. 또, 시사 잡지나 영어로 된 ted를 보면서 정보를 접하는거 좋아요.  꾸준히 읽는 것도 도움이 돼요. 다양한 관점에서 세계 정세를 이해할 수 있거든요. 물론 ‘독서’분야가 학교생활기록부에 기재안되지만 독서는 문해력의 바탕이므로 비판적 사고력을 키우는데 반드시 도움이 되는 밑거름이지요.",,,,,,,,,,,
,,학생,"감사합니다. 꼭 명심할게요. 방학 같은데 읽아보도록 할게요. 그런데, 제가 성적에 대해 조금 걱정이 돼요. 만약 특정 과목에서 성적이 잘 나오지 않으면 어떻게 해야 하나요?",,,,,,,,,,,
,,선생님,"성적이 잘 나오지 않을 때는 먼저 그 과목에서 부족한 부분을 분석해보는 게 중요해요. 어느 부분에서 어려움을 느끼는지 파악하고, 선생님이나 친구들에게 도움을 요청하는 것도 좋은 방법이에요. 그리고 복습이나 추가 학습을 통해 점차 개선해나가면 돼요. 모든 과목에서 완벽한 성적을 내기보다는, 꾸준히 성장하는 모습을 보여주는 것이 중요하답니다. 샘이 이어서 학업상담에 있어 다음 상담에 자세히 또 얘기해줄게요.",,,,,,,,,,,
,,학생,"감사합니다, 선생님. 이제 좀 더보다  구체적인 계획을 세울 수 있을 것 같아요. 다음에 또 궁금한 점이 생기면 여쭤보러 오겠습니다.",,,,,,,,,,,
,,선생님,"언제든지 와서 물어봐요. 응원할게요, 현이야.",,,,,,,,,,,
087,고교학점제,학생,"선생님, 내년에 과목을 선택해야 한다고 하는데, 뭐부터 골라야 할지 정말 모르겠어요. 고교학점제가 뭐고, 과목도 너무 많아서 헷갈려요.",,,,,,,,,,,
,,선생님,고교학점제는 학생들이 자신이 원하는 진로에 맞춰서 과목을 선택해서 들을 수 있는 제도야. 그래서 네가 선택할 과목이 중요한 거지.,,,,,,,,,,,
