구분,상담 주제,발화 주체,발화 내용,,,,,,,,,,,
,,학생,"...잘 모르겠어요. 그냥 별로 생각이 없어요.
",,,,,,,,,,,
,,선생님,"OO이의 평상시 생각이나 흥미, 적성 같은 것을 좀 더 자세히 살펴보는 시간이 필요할 것 같아.
",,,,,,,,,,,
,,학생,"어떻게 그걸 알 수 있죠?
",,,,,,,,,,,
,,선생님,"아는 만큼 보인다고, 성격이나 흥미, 적성 검사를 해 보고 나를 진단해 볼 수 있지. 그리고 관련 직업에 대해서 구체적으로 살펴보는 것도 도움이 될 거야.
",,,,,,,,,,,
,,학생,"...찾아 봐도 모를 것 같은데.
",,,,,,,,,,,
,,선생님,"해 보기 전엔 모르지. 오늘 선생님이랑 OO이의 흥미와 적성부터 잘 알아보자.
",,,,,,,,,,,
036,자아 탐색,선생님,"안녕! 왜 그렇게 힘이 없어? 얼굴에 힘들다고 써 있네. 요즘 진로 고민이 많니?
",,,,,,,,,,,
,,학생,아뇨... 별로...,,,,,,,,,,,
,,선생님,OO이가 오늘 상담하러 온 이유가 뭘까? 분명 선생님과 이야기하고 싶은 것이 있었을 거야.,,,,,,,,,,,
,,학생,"그게요... 제가 의대에 진학할 수 있을지 모르겠어요. 성적도 더 이상 안 오르고, 괜히 내게 맞지 않게 목표를 높게 잡았던 건가 싶기도 하고요...",,,,,,,,,,,
,,선생님,OO이가 많이 지쳤나 보구나.,,,,,,,,,,,
,,학생,의대 희망하는 친구들 중에 저보다 뛰어난 친구들이 너무 많아요. 대입 생각만 하면 가슴이 뛰면서 한숨이 나오고요.,,,,,,,,,,,
,,선생님,"OO이가 불안하고 힘든 이유를 잘 생각해 보고, 오늘 온 김에 허심탄회하게 이야기해 보자. 훨씬 마음이 편해질 거야.",,,,,,,,,,,
037,자아 탐색,학생,저는 뭘하면 좋을지 모르겠어요,,,,,,,,,,,
,,선생님,00이는 앞으로 뭘 할지 명확하게 정하지 못해서 고민이 많은거 같아. 혹시 특별히 좋아하는 건 있을까?,,,,,,,,,,,
,,학생,음 특별히는 없는데 수업시간에 내용 정리하고 알아보기 쉽게 정리하는 건 괜찮아요.,,,,,,,,,,,
,,선생님,그렇구나 혹시 가장 좋아하거나 제일 관심있는 과목은 있어?,,,,,,,,,,,
,,학생,저는 역사도 괜찮고 지리도 괜찮아요. 역사는 시간대별로 정리하고 사건미 어떻게 영향을 받는지 확인하는 것도 재밌고 지리는 뭔가 해석하는게 재밌는것 같아요,,,,,,,,,,,
,,선생님,00이는 사회분야에 관심이 많구나. 공부도 딱 명확하게 정리하는 스타일인 것 같네. 혹시 사회 관련된 학과는 생각해본 적이 있을까?,,,,,,,,,,,
,,학생,음 딱히 되고 싶은 직업은 없는데 그런 분야로 가면 나쁘지 않을 것 같긴 해요.,,,,,,,,,,,
,,선생님,그렇구나. 그럼 선생님 생각엔 우선 진단검사를 활용해서 00이가 어떤 사람인지 강점은 뭔지 한번 확인해보면 학과나 대학을 어디로 갈지 정하는 데 도움이 될 것 같아.,,,,,,,,,,,
,,학생,네 그럼 그렇게 할게요.,,,,,,,,,,,
,,선생님,그래 검사는 길게 안걸리니까 하나씩 명확하게 찾아가보자.,,,,,,,,,,,
038,자아 탐색,학생,쌤 저 계속 꿈이 선생님이었는데 전망이 별로 안 좋은 것 같아서 걱정돼요.,,,,,,,,,,,
,,선생님,"하고 싶은 직업이 전망이 안 좋아보여서 걱정이구나. 00이는 유치원이나 초등, 중고등중에 어떤 쪽으로 생각하고 있니?",,,,,,,,,,,
,,학생,저는 유치원 선생님이 되려구요.,,,,,,,,,,,
,,선생님,그렇구나. 00이가 유치원 선생님이 되고 싶은 이유가 뭔지 물어봐도 될까?,,,,,,,,,,,
,,학생,저는 뭔가 어떤 과목을 가르치는 것보다 애기들을 좋아하기도 하고 돌봐주는 게 잘 맞는 것 같아요.,,,,,,,,,,,
,,선생님,00이는 자신이 좋아하는 게 뭔지 확실히 알고 있는 것 같아. 선생님이 유치원 선생님이랑 관련된 직업 정보를 준비해서 상담을 하면 고민 해결에 도움을 줄 수 있을 것 같은데 어떄?,,,,,,,,,,,
,,학생,좋아요. ,,,,,,,,,,,
,,선생님,그래. 상담하면서 더 자세히 이야기 해보자,,,,,,,,,,,
039,자아 탐색,학생,선생님 저 진짜 어떤걸 해야할 지 모르겠어요. 대학은 가야하는데 아직 정한게 하나도 없어요,,,,,,,,,,,
,,선생님,00이가 대학 관련해서 걱정이 많구나. 평소에 좋아하거나 관심이 있다 싶은게 있을까?,,,,,,,,,,,
,,학생,그냥 모르겠어요. 딱히 관심있는 것도 없고 그냥 공부만해요.,,,,,,,,,,,
,,선생님,공부 외에 가장 자주 하는 것들은 있어?,,,,,,,,,,,
,,학생,"그냥 집에 가서 게임하고, 영화 보기? 종종 운동도 하긴 해요",,,,,,,,,,,
,,선생님,그렇구나. 혹시 예전에 생각해 봤던 진로가 있을까?,,,,,,,,,,,
,,학생,없는데요. 근데 대학은 가야하잖아요.,,,,,,,,,,,
,,선생님,00이가 어떤 대학이나 학과를 가야할지 막연해서 답답했을 것 같아. 너무 막연하다면 자신이 어떤 걸 좋아하고 잘 하는지 찾아보는 것부터 시작하면 돼. 이번엔 진단검사를 해서 00이가 어떤 사람인지를 확인해보자. ,,,,,,,,,,,
,,학생,알겠어요,,,,,,,,,,,
,,선생님,너무 조급해하지말고 차근차근히 찾아가보자. ,,,,,,,,,,,
,,학생,네,,,,,,,,,,,
040,자아 탐색,학생,"쌤 저는 화학이랑 생명과학을 제일 좋아해서 관련된 학과를 가려고 생각중인데요, 어떻게 하면 더 구체적으로 진로를 정할 수 있을까요?",,,,,,,,,,,
,,선생님,00이는 화학이랑 생명과학 중심으로 진로를 찾고 있구나. 구체적인 직업이나 학과에 대해서 찾아본 적이 있니?,,,,,,,,,,,
,,학생,"자연 과학이나 화학공학과, 생명공학과도 있었고, 제약같이 메디컬 계열도 있는건 아는데 구체적으로 정한 건 없어요.",,,,,,,,,,,
,,선생님,그렇구나. 특별히 화학이랑 생명과학 공부 외에도 따로 관련된 활동은 하는 것은 없어?,,,,,,,,,,,
,,학생,네. 일단 수업 중에는 그 두개가 제일 관심있어서 관련된 학과나 직업이면은 다 알아보고 나서 하고 싶어서요,,,,,,,,,,,
,,선생님,관련된 분야면 전부 관심이 있다는 말이지? 선생님 생각엔 직업관련 검사를 해보면 00이한테 맞는 직업을 또 알아볼 수 있으니까 해보면 좋을 것 같아.,,,,,,,,,,,
,,학생,네 근데 저는 구체적으로 뭘 잘하고 잘 할 수 있을지 알아보고 싶어요,,,,,,,,,,,
,,선생님,그래 그러면 선생님이 진단검사랑 지금 00이가 말한 직업이나 학과정보도 함께 준비해서 상담하면 더 도움이 될 것 같아.,,,,,,,,,,,
,,학생,네 알겠습니다.,,,,,,,,,,,
041,(진학) 학업,선생님,어서 오렴. 그동안 잘 지냈지? 오늘은 뭘 도와줄까?,,,,,,,,,,,
,,학생,"선생님~  부모님께서 제가 의대에 진학하면 좋겠다고 하시고, 저도 의대에 관심이 있는데, 어떻게 학생부와 세특관리를 해야할 지 모르겠어요",,,,,,,,,,,
,,선생님,"은서가 의대에 관심이 있구나~  그럼 의대에 대해서는 언제부터 관심이 있었고, 그동안은 어떻게 준비했니?",,,,,,,,,,,
,,학생,"관심은 중학교때부터 있었구, 그동안 공부 이외에는 준비를 한 것은 없어요.",,,,,,,,,,,
,,선생님,"럼 요새 의대가겠다는학생도 많고, 대학에서 지원자를 선발하는 방법도 여러가지가 있어서 은서에게 맞는 학생부, 교과활동에 대해 선생님과 함께 알아볼까?",,,,,,,,,,,
042,(진학) 학업,선생님,어서 오렴. 그동안 잘 지냈지? 오늘은 뭘 도와줄까?,,,,,,,,,,,
,,학생,선생님. 제가 스카이대학을 가고 싶은데요. 지금부터 얼마나 어떻게 공부하면 좋을지요,,,,,,,,,,,
,,선생님,오~ 우리 은서가 드디어 목표를 정했구나. 멋진 걸~  스카이 대학에 가겠다니 공부를 열심히 해야할텐데…,,,,,,,,,,,
,,학생,부모님과 주위에 도와주시는 분들과 함께 열심히 공부해 보려구요,,,,,,,,,,,
,,선생님,"그럼, 선생님과 함께 내신, 수능, 학생부 준비 등에 대해 하나씩 하나씩 알아가면서 차근히 준비해볼까? ",,,,,,,,,,,
043,(진학) 학업,선생님,"학업에 대한 고민이 있다고 했는데, 구체적으로 어떤 부분이 가장 어려운가요?",,,,,,,,,,,
,,학생,공부는 열심히 하는데 성적이 잘 오르지 않아서 답답해요.,,,,,,,,,,,
,,선생님,어느 과목에서 특히 어려움을 느끼고 있나요?,,,,,,,,,,,
,,학생,"수학이 가장 어렵고, 성적도 잘 안 나와요.",,,,,,,,,,,
,,선생님,수학은 기초가 중요한 과목이에요. 기본 개념은 잘 이해하고 있나요?,,,,,,,,,,,
,,학생,"개념은 이해한다고 생각했는데, 문제를 풀 때는 잘 안 풀려요.",,,,,,,,,,,
,,선생님,그럼 문제를 푸는 방식에 변화를 줄 필요가 있겠네요. 문제를 푼 후에 오답 노트를 작성해보는 건 어때요?,,,,,,,,,,,
,,학생,"오답 노트는 해본 적이 없는데, 효과가 있을까요?",,,,,,,,,,,
,,선생님,오답 노트는 자신의 약점을 파악하고 보완하는 데 큰 도움이 돼요. 틀린 문제를 다시 풀어보면서 왜 틀렸는지 생각해보는 거죠.,,,,,,,,,,,
,,학생,한 번 해봐야겠어요. 그런데 시간이 너무 오래 걸리지 않을까요?,,,,,,,,,,,
,,선생님,"처음엔 시간이 걸리겠지만, 익숙해지면 공부 효율이 훨씬 좋아질 거예요.",,,,,,,,,,,
044,(진학) 학업,선생님,오답 노트 작성은 해봤나요?,,,,,,,,,,,
,,학생,"네, 몇 번 해봤는데 시간이 좀 걸리긴 했어요.",,,,,,,,,,,
,,선생님,그래도 꾸준히 하다 보면 성적이 오르는 걸 느낄 수 있을 거예요.,,,,,,,,,,,
,,학생,"네, 더 열심히 해볼게요. 그런데 내신 관리도 신경 써야 하는데, 어떻게 하면 좋을까요?",,,,,,,,,,,
,,선생님,내신 관리는 꾸준한 복습이 중요해요. 시험 기간만 집중하기보다는 매일 조금씩 공부하는 습관을 들이는 게 좋아요.,,,,,,,,,,,
,,학생,"매일 공부하는 건 어렵지만, 시도해볼게요.",,,,,,,,,,,
,,선생님,처음엔 적은 양부터 시작해서 점차 늘려가면 될 거예요. 작은 성공을 쌓아가는 것이 중요하니까요.,,,,,,,,,,,
,,학생,알겠습니다. 내신도 신경 쓰면서 공부할게요.,,,,,,,,,,,
,,선생님,그렇게 꾸준히 노력하면 좋은 결과를 얻을 수 있을 거예요.,,,,,,,,,,,
,,학생,"네, 열심히 해보겠습니다!",,,,,,,,,,,
045,(진학) 학업,학생,"안녕하세요, 선생님. 학교생활기록부 관리에 대해 여쭤보고 싶어서요. 어떤 활동들을 기록하는 게 좋을까요?",,,,,,,,,,,
,,선생님,"학교생활기록부는 교과 성적뿐만 아니라, 각종 활동과 교과목 세부능력 특기사항이 매우 중요해요. 본인의 진로와 관련된 활동을 적극적으로 참여하고, 이를 잘 기록하는 것이 좋아. 대학교 갈때, n수생과 경쟁하지 않으려면, 현역에게 유리한 수시전형으로 가는게 상대적으로 유리하니까..",,,,,,,,,,,
,,학생,"앗, 진짜요... 내신도 안좋은데... 우선 또 그렇다면 어떤 활동을 구체적으로 해야 할지 잘 모르겠어요.",,,,,,,,,,,
,,선생님,관심 희망 계열은 혹시 어느 분야이니? 꿈에대해 말해줘볼래?,,,,,,,,,,,
,,학생,아직 꿈은 정확히 못정했고요...솔직히.. 희망 계열 진로는 경영학 쪽으로 생각 중인데요.,,,,,,,,,,,
,,선생님,"경영학이라면, 경제나 기업 관련 활동에 참여해보는 것이 좋겠네요. 예를 들어, 경제 동아리나 창업 관련 프로젝트, 경시 대회 같은 활동을 추천할게.",,,,,,,,,,,
,,학생,그럼 교과목 세부능력 특기사항에는 어떤 내용을 적으면 좋을까요?,,,,,,,,,,,
,,선생님,"세부능력 특기사항은 수업 중에 적극적으로 발표하거나, 팀 프로젝트에서 리더 역할을 맡는 등의 활동을 구체적으로 기록하는 것이 좋아. 각 과목에서 어떤 역량을 키웠는지도 언급하면 좋고. 대학교 갈때 중요한 이 학생이 우리 대학교에와서 수학할 학업적 잠재력을 보옂는 것이 무엇보다 중요하게 다뤄지는 요소란다.",,,,,,,,,,,
,,학생,"과목마다 다른 내용을 적으려니 부담이 될 때가 있는데, 모든 과목에 다 기록을 잘 남겨야 하나요?",,,,,,,,,,,
,,선생님,"경영학에 가고싶다 했지? 경영, 경제 관련교과인 사회나 전반적으로 국어,또 영어, 사회 및 수학까지 잘 받으면 좋고 더 나아가 전교과에 걸쳐서 받으면 금상첨화긴하지. 그런데 다챙기기 힘들다면 ‘선택과집중’을 하는 것도 좋아.",,,,,,,,,,,
,,학생,흐앙.. 다행이에요 샘~! 전과목 다신경쓰려고 하니 순간 앞이 하얘졌었어요.,,,,,,,,,,,
,,선생님,"모든 과목을 완벽하게 관리하기는 어렵겠지만, 진로와 관련된 핵심 과목들은 신경 써서 관리해야 해요. 특히 본인이 흥미 있는 과목에서 꾸준한 성취와 참여를 보이는 것이 중요하단다.",,,,,,,,,,,
,,학생,"알겠습니다. 그럼 앞으로는 제가 활동하는 걸 더 구체적으로 기록하고, 선생님께 자주 확인받도록 하겠습니다.",,,,,,,,,,,
046,(진학) 학업,학생,"선생님, 요즘 내신 성적 때문에 고민이 많아요. 특히 수학과 과학 성적이 잘 안 나와서 걱정이에요.",,,,,,,,,,,
,,선생님,내신 관리는 매우 중요한 부분이지. 특히 수학과 과학은 개념 이해가 중요해. 어려움을 느끼는 부분이 있니?,,,,,,,,,,,
,,학생,"네, 개념은 어느 정도 알겠는데 문제풀이에서 실수가 많아요. 어떻게 하면 실수를 줄일 수 있을까요?",,,,,,,,,,,
,,선생님,"문제풀이에서 실수를 줄이기 위해서는 먼저 문제를 꼼꼼하게 읽고, 단계별로 풀이 과정을 확인하는 연습이 필요해. 평소 문제 풀이 시간을 재면서 푸는 습관도 도움이 될 거란다.",,,,,,,,,,,
,,학생,알겠습니다. 그런데 공부 습관도 잘 안 잡혀서 자주 집중력이 흐트러져요. 좋은 공부 습관을 어떻게 만들 수 있을까요?,,,,,,,,,,,
,,선생님,"우선 짧게라도 계획을 세우고, 정해진 시간 동안 집중하는 습관을 들이는 게 중요해. 너무 무리하지 말고, 일정 시간 공부하고 나서 휴식을 취하는 것도 효과적이란다.",,,,,,,,,,,
,,학생,그래도 성적이 안 오르면 어떡하죠? 공부해도 성과가 잘 안 나는 것 같아서요.,,,,,,,,,,,
,,선생님,성적이 바로 오르지 않더라도 꾸준히 하면 반드시 결과가 나와. 계단식으로 성적이 오르는 그런 경우가 있거든? 바로 선생님이 고등학교 3학년때 열심히 공부할 때 경험했었어.,,,,,,,,,,,
,,학생,선생님의 사례시라고요 ?대박,,,,,,,,,,,
,,선생님,"응, 진짜로. 중요한 건 꾸준한 복습과 반복 학습이양. 모르는 부분은 반드시 체크하고 해결하는 습관을 들이면 학업 성과도 점차 개선될 거야.",,,,,,,,,,,
,,학생,감사합니다. 앞으로는 계획을 세우고 꾸준히 실천해볼게요. 샘이 진짜로 사례로 얘기해주시니 더 하고싶은 마음이 생겼어요. 진심으로 감사드립니다.,,,,,,,,,,,
,,선생님,"응, 그래. 다음에 하다가 또 중간 점검받으러 또오렴.ㅎㅎㅎㅎㅎ",,,,,,,,,,,
047,학업,학생,선생님 저 요즘 성적이 잘 안 나와서 상담이 필요해요. 공부를 어떻게 해야 될지 모르겠어요.,,,,,,,,,,,
,,선생님,"그래, 성적 때문에 고민이 많구나. 혹시 어느 과목이 특히 어려운지, 아니면 전반적으로 힘든건지 이야기 해줄 수 있을까?",,,,,,,,,,,
,,학생,주로 수학이랑 영어가 잘 안돼요. 아무리 공부해도 점수가 잘 안 올라요.,,,,,,,,,,,
,,선생님,수학이랑 영어에서 어려움을 겪고 있구나. 공부할 때 어떻게 하고 있니? 특별한 공부 방법이 있거나 계획을 세워하고 있니?,,,,,,,,,,,
,,학생,"아뇨... 그냥 학교 수업 들은 거 복습하고 문제집 푸는 정도로 진행하고 있어요. 그런데 시간이 부족해서 다 못할 때도 많고, 계획대로 잘 안되는 거 같아요.",,,,,,,,,,,
,,선생님,"계획대로 하기 어려운 부분이 있구나. 공부 습관이랑 시간 관리에서 개선이 필요한 것 같네. 혹시 평소에 공부할 때 집중이 잘 안 되거나, 어디서부터 시작해야 할지 막막한 적도 있었니?",,,,,,,,,,,
,,학생,"네, 맞아요. 막상 책상 앞에 앉아도 집중이 잘 안되고, 할 게 많다 보니까 뭐부터 해야 할지 모르겠어요.",,,,,,,,,,,
,,선생님,"그런 경우가 자주 생기면 성적이 오르게 힘들지. 그럼, 네 공부 습관을 점검하고 어떻게하면 더 효과적으로 공부할 수 있을지 함께 방법을 찾아보면 좋을 거 같아.",,,,,,,,,,,
,,학생,네 좋아요. 어떻게 공부해야 할지 명확해지면 더 집중할 수 있을 거 같아요.,,,,,,,,,,,
,,선생님,"좋아. 그럼 다음 상담 전까지 네가 공부하는 방식과 계획을 점검해보고, 성적을 올리기 위한 구체적인 방법을 찾아보자.",,,,,,,,,,,
,,학생,넵 알겠습니다.,,,,,,,,,,,
048,학업,학생,선생님. 이번 시험을 제대로 망했어요. 요즘 부쩍 성적이 잘 안나와서 어떻게 해야 할지 모르겠어요.,,,,,,,,,,,
,,선생님,"그래, 성적이 잘 안 나와서 고민이구나. 혹시 어느 과목에서 특히 성적이 떨어졌니?",,,,,,,,,,,
,,학생,"주로 국어랑 사회 과목에서 성적이 많이 떨어졌어요. 시험 때마다 문제를 다 푼 것 같은데, 점수가 생각보다 낮게 나와요,.",,,,,,,,,,,
,,선생님,시험을 봤을 때 문제를 다 제대로 푼 것 같아도 점수가 잘 안 나오는 경우가 있지. 혹시 시험 준비는 어떻게 하고 있니? 시험 전 공부 방법이나 시간 분배 같은 걸 어떻게 하고 있는지 궁금해.,,,,,,,,,,,
,,학생,"그냥 책을 여러번 읽고, 기출문제를 풀어보고 있어요.",,,,,,,,,,,
,,선생님,그렇구나. 책을 여러 번 읽고 기출문제를 풀어보는 건 좋은 방법이야. 시험 볼 때는 어때? 시험 때마다 긴장을 많이 하는 편이니?,,,,,,,,,,,
,,학생,헐 맞아요. 시험 볼 때 너무 긴장해서 문제를 풀다가 실수하는 경우가 좀 있어요.,,,,,,,,,,,
,,선생님,"그렇구나. 시험 볼 때 긴장하는 건 누구에게나 있을 수 있는 일이야. 긴장하면 실수할 확률도 높아지고, 특히 시간에 쫓기다 보면 더 그럴 수 있어. 그럼 우리 함께 어떻게하면 시험 중 긴장을 덜 하고 실수를 줄일 수 있을지 생각해볼까?",,,,,,,,,,,
,,학생,네 선생님. 어떻게하면 긴장을 덜 할 수 있을까요?,,,,,,,,,,,
,,선생님,"우선 시험 전에 할 수 있는 마음가짐 훈련이나 시간 관리 방법을 배우는 게 중요해. 또, 시험 중에 갑자기 막막해질 때 대처할 수 있는 몇 가지 방법도 함께 연습하면 좋아. 실수 줄이기에 도움이 될 거야.",,,,,,,,,,,
,,학생,그런 방법이 있으면 좋을 거 같아요... 제가 실수만 안 하면 성적이 더 잘 나올 거 같은데....,,,,,,,,,,,
,,선생님,"실수를 줄이면 분명 성적도 더 잘 나올 거야. 그럼, 다음 상담까지 긴장감을 다스리고 시험을 차분하게 볼 수 있는 연습과 방법에 대해서 고민하고 생각해보자. 문제를 푸는 순서나 시간 배분도 함께 고민해보면 좋겠어.",,,,,,,,,,,
,,학생,"네, 감사합니다. 선생님",,,,,,,,,,,
049,학업,선생님,"상담 신청서를 보니까, 학생부 관리 때문에 왔다고 작성되어 있네요. 구체적으로 어떤 부분이 고민인가요?",,,,,,,,,,,
,,학생,"요즘 대학 보면 학생부가 중요하다고 하는데, 제가 잘 쓰고 있는건지 잘 모르겠어요.",,,,,,,,,,,
,,선생님,현재 학생부에 기재된 내용 중에서 특별히 신경 쓰이는 부분이 있나요?,,,,,,,,,,,
,,학생,"특히 수행평가 부분이요. 발표할 때 긴장해서 잘 못한 것 같은데, 그게 어떻게 기록될지 걱정이에요.",,,,,,,,,,,
,,선생님,학생부에서 수행평가 관련 기록이 주로 어디에 반영되는지 알고 있나요?,,,,,,,,,,,
,,학생,교과세특... 이라고 하던데 정확히는 잘 모르겠어요.,,,,,,,,,,,
,,선생님,"그렇군요. 그럼 먼저 교과세특이 뭔지, 어떤 내용이 들어가는지 함께 알아보는 게 좋겠네요. 그리고 나서 수행평가 내용도 같이 살펴보는 건 어떨까요?",,,,,,,,,,,
,,학생,네. 좋아요! 그리고 앞으로 어떤 걸 준비해야 할지도 알고 싶어요.,,,,,,,,,,,
,,선생님,그래요. 그럼 학생부 중에서도 특히 교과세특을 중심으로 이야기를 나눠보도록 할게요.,,,,,,,,,,,
050,학업,선생님,오늘은 어떤 이야기를 나누고 싶어서 왔나요?,,,,,,,,,,,
,,학생,"공부하는 방법을 잘 모르겠어요. 열심히 하는 것 같은데, 성적이 안 올라요.",,,,,,,,,,,
,,선생님,그렇군요. 현재 어떤 방식으로 공부하고 있나요?,,,,,,,,,,,
,,학생,교과서랑 문제집을 최대한 반복해서 풀고 있어요. 근데 시험 보면 비슷한 문제도 틀려요.,,,,,,,,,,,
,,선생님,하루에 보통 얼마나 공부하나요?,,,,,,,,,,,
,,학생,학원 다녀와서 새벽 1시까지는 하는 거 같아요. 근데 집중이 잘 안돼요,,,,,,,,,,,
,,선생님,긴 시간 동안 공부하고 있네요. 혹시 과목별로 공부하는 방식의 차이는 있나요?,,,,,,,,,,,
,,학생,아니요...... 다 비슷하게 해요. 그게 문제인가요?,,,,,,,,,,,
,,선생님,"과목별 특성에 따라 효과적인 학습 방법이 다를 수 있어요. 다음 상담에서는 네가 주로 어려움을 겪는 과목들을 중심으로, 과목별 학습 전략을 세워보는 건 어떨까요?",,,,,,,,,,,
,,학생,네! 그게 좋을 거 같아요.,,,,,,,,,,,
,,선생님,좋아요. 그럼 다음에 볼 때는 각 과목별로 어떤 부분이 어려운지 미리 생각해오면 좋겠어요.,,,,,,,,,,,
051,학업,학생,쌤 건대랑 충북대 수의학과 전년도 내용 찾아봤어요.,,,,,,,,,,,
,,선생님,OO이가 봤을 때 이해가 좀 가니?,,,,,,,,,,,
,,학생,명확하게는 모르겠지만 일단 내신 성적이 엄청 중요한 건 알겠어요.,,,,,,,,,,,
,,선생님,선생님이 보니까 수의대는 내신은 물론이고 수능이나 논술도 필요할 수도 있겠다.,,,,,,,,,,,
,,학생,저 이대로 수시 준비 괜찮을까요?,,,,,,,,,,,
,,선생님,일단 OO이 1학년 때 성적은 OK. 2학년 1학기가 조금 걱정이지만 2학기랑 3학년 때 커트라인 맞춰서 준비하면 문젠 없을 것 같네. 우선 교과전형이랑 종합전형 중에 어디에 더 목표할지 같이 계획을 짜보면 좋을 것 같아.,,,,,,,,,,,
,,학생,저.. 근데 1학년 때 활동이 거의 없어서요 학생부가 좀 약한데 괜찮을까요?,,,,,,,,,,,
,,선생님,"지금부터 알차게 준비하면 성장 곡선을 보여줄 수 있는 기회가 될 수 있으니 걱정 말고! 일단 남은 2학기부터 앞으로 내신이랑 활동, 세특 준비 어떻게 계획하고 있는지 아니면 목표 같은 것들 작성해서 준비해 올래?",,,,,,,,,,,
052,학업,학생,선생님 교과세특은 제가 따로 작성하거나 관리하는 건가요?,,,,,,,,,,,
,,선생님,"교과 선생님께서 세특과 관련되어 과제를 주시거나, 방법을 알려주실거야. 그러면 그걸 OO이가 열심히 준비해서 선생님께 제출하거나 발표를 하면 돼",,,,,,,,,,,
,,학생,아~ 제가 따로 작성하는 건 아니란 거죠?,,,,,,,,,,,
,,선생님,응응 교과 선생님께서 OO이가 제출하거나 발표하는 내용을 보고 평가를 작성해 주시는 거야,,,,,,,,,,,
,,학생,그러면 교과 선생님과도 따로 상담을 받는 게 좋을까요?,,,,,,,,,,,
,,선생님,"당연하지 그게 가장 좋은 방법이지. 근데 어떤 교과가 되었든 OO이가 이걸 왜 준비했는지, 어떤 부분에서 내가 가장 흥미로움을 느꼈고, 그게 나에게 어떤 영향을 끼쳤는지 처럼 나와, 세특 과제와 잘 연결 짓는 게 정말 중요하단다",,,,,,,,,,,
053,학업,선생님,OO이 오늘 상담받고 싶은 내용이 뭘까?,,,,,,,,,,,
,,학생,중학교랑 너무 달라서 공부를 어떻게 해야 할지 모르겠어요. ,,,,,,,,,,,
,,선생님,무엇을 공부해야 할 지 모르겠다는 걸까? 학과나 대학 정보 등 찾는 방법을 도와주면 될까?,,,,,,,,,,,
,,학생,아뇨. 목표 대학이랑 학과는 있구요. 제게 약한 과목도 알아요. 그런데 공부해야지 하다가 놀기만 해요.,,,,,,,,,,,
,,선생님,"아아~ 그러면 시간 관리랑, 공부 습관에 대해서 이야기를 하면 좋겠다.",,,,,,,,,,,
,,학생,맞아요.. 아 누가 시간마다 저를 잡아다 공부하라고 시키면 좋겠는데,,,,,,,,,,,
,,선생님,"ㅎㅎ OO아 그러면 먼저 평소 어떻게 공부를 하는지, 시간은 어떻게 관리하고 있는지 체크를 해보자. 선생님이 주는 양식에 맞춰서 답변을 써 올래?",,,,,,,,,,,
,,학생,이게 왜요? 그냥 말로만 상담해도 되지 않나요?,,,,,,,,,,,
